{
  "name": "day1",
  "exercises": [
    {
      "name": "squat_heavy",
      "catalog": "BarbellBackSquat",
      "sets": [
        {
          "type": "setRef",
          "label": "a",
          "exercise": "BarbellBackSquat",
          "target": { "kind": "reps", "value": 5 },
          "load": { "kind": "weight", "value": 80, "unit": "kg" }
        }
      ],
      "groups": [],
      "body": {
        "type": "group",
        "kind": "straight",
        "interleave": "sequential",
        "rest": { "mode": "single" },
        "termination": { "mode": "count", "n": 1 },
        "atomic": false,
        "members": [
          {
            "type": "setRef",
            "label": "a",
            "exercise": "BarbellBackSquat",
            "target": { "kind": "reps", "value": 5 },
            "load": { "kind": "weight", "value": 80, "unit": "kg" }
          }
        ]
      }
    },
    {
      "name": "squat_light",
      "catalog": "BarbellBackSquat",
      "sets": [
        {
          "type": "setRef",
          "label": "a",
          "exercise": "BarbellBackSquat",
          "target": { "kind": "reps", "value": 5 },
          "load": { "kind": "weight", "value": 56, "unit": "kg" }
        }
      ],
      "groups": [],
      "body": {
        "type": "group",
        "kind": "straight",
        "interleave": "sequential",
        "rest": { "mode": "single" },
        "termination": { "mode": "count", "n": 1 },
        "atomic": false,
        "members": [
          {
            "type": "setRef",
            "label": "a",
            "exercise": "BarbellBackSquat",
            "target": { "kind": "reps", "value": 5 },
            "load": { "kind": "weight", "value": 56, "unit": "kg" }
          }
        ]
      }
    }
  ],
  "groups": [],
  "body": {
    "type": "group",
    "kind": "straight",
    "interleave": "sequential",
    "rest": { "mode": "single" },
    "termination": { "mode": "count", "n": 1 },
    "atomic": false,
    "members": [
      {
        "type": "group",
        "kind": "straight",
        "interleave": "sequential",
        "rest": { "mode": "single" },
        "termination": { "mode": "count", "n": 1 },
        "atomic": false,
        "members": [
          {
            "type": "setRef",
            "label": "a",
            "exercise": "BarbellBackSquat",
            "target": { "kind": "reps", "value": 5 },
            "load": { "kind": "weight", "value": 80, "unit": "kg" }
          }
        ]
      }
    ]
  }
}
