{
  "name": "day1",
  "exercises": [
    {
      "name": "squat",
      "catalog": "BarbellBackSquat",
      "sets": [
        {
          "type": "setRef",
          "label": "top_set",
          "exercise": "BarbellBackSquat",
          "target": { "kind": "reps", "value": 5 },
          "load": { "kind": "weight", "value": 100, "unit": "kg" }
        }
      ],
      "body": {
        "type": "group",
        "kind": "straight",
        "interleave": "sequential",
        "rest": { "mode": "single" },
        "termination": { "mode": "count", "n": 1 },
        "atomic": false,
        "members": [
          {
            "type": "setRef",
            "label": "top_set",
            "exercise": "BarbellBackSquat",
            "target": { "kind": "reps", "value": 5 },
            "load": { "kind": "weight", "value": 100, "unit": "kg" }
          }
        ]
      },
      "progress": {
        "stmts": [
          {
            "type": "if",
            "cond": {
              "type": "comparison",
              "op": ">",
              "left": { "type": "path", "path": "tm.squat.weight" },
              "right": { "type": "number", "value": 150 }
            },
            "then": [
              {
                "type": "assign",
                "path": "tm.squat.weight",
                "expr": {
                  "type": "add",
                  "left": { "type": "path", "path": "tm.squat.weight" },
                  "right": { "type": "number", "value": 2.5 }
                }
              }
            ],
            "else": [
              {
                "type": "assign",
                "path": "tm.squat.weight",
                "expr": {
                  "type": "add",
                  "left": { "type": "path", "path": "tm.squat.weight" },
                  "right": { "type": "number", "value": 5 }
                }
              }
            ]
          }
        ]
      }
    }
  ],
  "groups": [],
  "body": {
    "type": "group",
    "kind": "straight",
    "interleave": "sequential",
    "rest": { "mode": "single" },
    "termination": { "mode": "count", "n": 1 },
    "atomic": false,
    "members": [
      {
        "type": "setRef",
        "label": "top_set",
        "exercise": "BarbellBackSquat",
        "target": { "kind": "reps", "value": 5 },
        "load": { "kind": "weight", "value": 100, "unit": "kg" }
      }
    ]
  }
}
