{
  "name": "day1",
  "exercises": [
    {
      "name": "squat",
      "catalog": "BarbellBackSquat",
      "sets": [
        {
          "type": "setRef",
          "label": "top_set",
          "exercise": "BarbellBackSquat",
          "target": { "kind": "reps", "value": 8 },
          "load": { "kind": "weight", "value": 60, "unit": "kg" }
        }
      ],
      "body": {
        "type": "group",
        "kind": "straight",
        "interleave": "sequential",
        "rest": { "mode": "single" },
        "termination": { "mode": "count", "n": 1 },
        "atomic": false,
        "members": [
          {
            "type": "setRef",
            "label": "top_set",
            "exercise": "BarbellBackSquat",
            "target": { "kind": "reps", "value": 8 },
            "load": { "kind": "weight", "value": 60, "unit": "kg" }
          }
        ]
      },
      "progress": {
        "stmts": [
          {
            "type": "if",
            "cond": {
              "type": "comparison",
              "op": ">=",
              "left": { "type": "log", "label": "top_set", "field": "reps" },
              "right": { "type": "number", "value": 8 }
            },
            "then": [
              {
                "type": "assign",
                "path": "tm.squat.reps",
                "expr": { "type": "log", "label": "top_set", "field": "reps" }
              },
              {
                "type": "assign",
                "path": "tm.squat.weight",
                "expr": { "type": "log", "label": "top_set", "field": "weight" }
              },
              {
                "type": "if",
                "cond": {
                  "type": "comparison",
                  "op": ">=",
                  "left": { "type": "path", "path": "tm.squat.reps" },
                  "right": { "type": "number", "value": 12 }
                },
                "then": [
                  {
                    "type": "assign",
                    "path": "tm.squat.weight",
                    "expr": {
                      "type": "add",
                      "left": { "type": "path", "path": "tm.squat.weight" },
                      "right": { "type": "number", "value": 5 }
                    }
                  },
                  {
                    "type": "assign",
                    "path": "tm.squat.reps",
                    "expr": { "type": "number", "value": 8 }
                  }
                ],
                "else": [
                  {
                    "type": "assign",
                    "path": "tm.squat.reps",
                    "expr": {
                      "type": "add",
                      "left": { "type": "path", "path": "tm.squat.reps" },
                      "right": { "type": "number", "value": 1 }
                    }
                  }
                ]
              }
            ]
          }
        ]
      }
    }
  ],
  "groups": [],
  "body": {
    "type": "group",
    "kind": "straight",
    "interleave": "sequential",
    "rest": { "mode": "single" },
    "termination": { "mode": "count", "n": 1 },
    "atomic": false,
    "members": [
      {
        "type": "group",
        "kind": "straight",
        "interleave": "sequential",
        "rest": { "mode": "single" },
        "termination": { "mode": "count", "n": 1 },
        "atomic": false,
        "members": [
          {
            "type": "setRef",
            "label": "top_set",
            "exercise": "BarbellBackSquat",
            "target": { "kind": "reps", "value": 8 },
            "load": { "kind": "weight", "value": 60, "unit": "kg" }
          }
        ]
      }
    ]
  }
}
